{
  "schema_version": 1,
  "review_batch_id": "speaker_review_daniel_solo_fixture_001",
  "recording_id": "rec_fixture_daniel_owned_solo_001",
  "duration_ms": 12000,
  "review_state": "human_reviewed",
  "reviewer_id": "reviewer_fixture_a",
  "reviewed_at": "2026-08-26T12:00:00Z",
  "source_identity_attestation": {
    "attestation_id": "source_identity_attestation_fixture_001",
    "source_confirmation": "confirmed_daniel_owned_source",
    "source_confirmation_evidence": "Fixture provenance represents a human-confirmed Daniel-owned source; replace this with the reviewed catalog evidence reference.",
    "public_label": "Daniel",
    "basis": "confirmed_daniel_source_solo_presumption",
    "review_scope": "complete_recording",
    "reviewed_live_speaker_count": 1,
    "title_context_assessment": "no_contradiction_found",
    "reviewer_id": "reviewer_fixture_a",
    "reviewer_kind": "human",
    "reviewed_at": "2026-08-26T12:00:00Z",
    "comment": "The complete fixture was reviewed as one live speaker with no guest or contradictory title/context cue; visual confirmation is not part of this source-wide presumption."
  },
  "intervals": [
    {
      "hint_id": "hint_daniel_solo_001",
      "start_ms": 0,
      "end_ms": 12000,
      "speech_presence": "present",
      "speech_multiplicity": "single",
      "audio_origin": "live_voice",
      "face_visibility": "none",
      "speaker_visual_relation": "offscreen",
      "review_confidence": "high",
      "comment": "One live off-screen speaker was reviewed throughout this fixture; the source-wide solo attestation, not a face observation, supplies the Daniel presumption."
    }
  ]
}
